{
  "$schema": "https://raw.githubusercontent.com/thecats1105/discord-rpc-selfbot/refs/heads/main/config.schema.json",
  "APPLICATION_ID": "1103326187348050024",
  "type": "LISTENING",
  "name": "Spotify",
  "details": "Life of a Developer",
  "state": "Tense",
  "streamURL": "",
  "party": {
    "size": {
      "current": null,
      "max": null
    }
  },
  "setLocalTime": true,
  "timezone": "Asia",
  "startTimeStamp": null,
  "endTimeStamp": null,
  "assets": {
    "large_image": "spotify:ab67706c0000bebb8d0ce13d55f634e290f744ba",
    "large_text": "Developing Life",
    "small_image": "",
    "small_text": ""
  },
  "buttons": [
    {
      "label": "My Bio!",
      "url": "https://guns.lol/tense"
    },
    {
      "label": "",
      "url": ""
    }
  ],
  "refreshInterval": null
}
